firma,email,region,stadt,website,notizen
BPB Immobilien GmbH,info@bpb-bau.de,hamburg,hamburg,https://bpb-bau.de/,"Die BPB Immobilien GmbH ist ein renommiertes Unternehmen mit Sitz in Hamburg, baut wohnungen und häuser in hamburg und schleswig-holstein"
WEST-ELBE Bauträger- und Handels GmbH,info@west-elbe.de,hamburg,hamburg,https://west-elbe.de/,baut wohnungen und häuser in hamburg und schleswig-holstein
Strenger Holding GmbH,kontakt@strenger.de,bayern,münchen,https://strenger.de/,baut wohnungen in ganz deutschland und sitzt in Ludwigsburg
SYLT SOTHEBY'S REALTY,office@sylt-sothebysrealty.com,schleswig-holstein,sylt,https://sylt-sothebysrealty.com/,baut häuser und wohnungen auf sylt
Nordfinance GmbH,info@nordfinance.de,nordsee,grömitz,https://nordfinance.de/,baut wohnungen und häuser in der nordsee region
Grundstücksgesellschaft Manke GmbH & Co. KG,info@manke-bau.de,nordsee,Henstedt-Ulzburg,https://www.manke-bau.de/,baut wohnungen und häuser in der nordsee region
Herden Immobilien Mallorca,info@herden-immobilien.com,spanien,mallorca,https://www.herden-immobilien.com/de-DE,baut häuser und wohnungen auf mallorca
Porta Mallorquina,info@portamallorquina.com,spanien,mallorca,https://www.porta-mallorquina.de/,baut häuser und wohnungen auf mallorca
Axel Bock Immobilien Service S.L.,info@mallorca-topimmobilien.de,spanien,mallorca,https://www.mallorca-topimmobilien.de/de/,baut häuser und wohnungen auf mallorca
Hamburg Homes,mail@hamburghomes.com,hamburg,hamburg,https://www.hamburghomes.de/,baut wohnungen und häuser in hamburg
